<?xml version="1.0" encoding="UTF-8"?>
<!DOCTYPE template PUBLIC "-//SEASAR//DTD S2JFace 0.1//EN" 
	"http://www.seasar.org/dtd/s2jface01.dtd">
<template name="groupRendererTest">
  <window id="groupRendererTest" title="groupRendererTest" x="center"
    y="middle" minButton="false" maxButton="false" closeButton="false"
    resizable="false" layout="grid" layoutParam="numColumns=1">
    <property name="defaultButton">okButton</property>

    <composite type="box" layout="row"
      layoutParam="type=HORIZONTAL; marginHeight=10; marginWidth=10; spacing=10">
      <property name="fontSize">20</property>
      <layoutData name="horizontalAlignment">FILL</layoutData>

      <composite type="group" layout="row"
        layoutParam="type=VERTICAL; spacing=10">
        <property name="text">グループ1</property>

        <control type="button" style="RADIO">
          <property name="text">ラジオボタン1</property>
        </control>

        <control type="button" style="RADIO">
          <property name="text">ラジオボタン2</property>
        </control>

        <control type="button" style="RADIO">
          <property name="text">ラジオボタン3</property>
        </control>
      </composite>

      <composite type="group" layout="row"
        layoutParam="type=VERTICAL; spacing=10">
        <property name="text">グループ2</property>

        <control type="button" style="RADIO">
          <property name="text">ラジオボタン1</property>
        </control>

        <control type="button" style="RADIO">
          <property name="text">ラジオボタン2</property>
        </control>

        <control type="button" style="RADIO">
          <property name="text">ラジオボタン3</property>
          <property name="selection">true</property>
        </control>

        <control type="button" style="RADIO">
          <property name="text">ラジオボタン4</property>
        </control>
      </composite>

    </composite>

    <control type="label" style="SEPARATOR, HORIZONTAL">
      <layoutData name="horizontalAlignment">FILL</layoutData>
    </control>

    <composite type="box" layout="fill"
      layoutParam="type=HORIZONTAL; spacing=5">
      <layoutData name="horizontalAlignment">FILL</layoutData>
      <control type="button" id="okButton">
        <property name="text">OK</property>
      </control>
      <control type="button" id="ngButton">
        <property name="text">NG</property>
      </control>
    </composite>

  </window>
</template>
