<?xml version="1.0" encoding="UTF-8"?>
<!DOCTYPE template PUBLIC "-//SEASAR//DTD S2JFace 0.1//EN" 
	"http://www.seasar.org/dtd/s2jface01.dtd">
<template name="menuRendererTest">
  <window id="menuRendererTest" style="TITLE" layout="grid"
    layoutParam="numColumns=1">
    <property name="title">MenuRendererTest</property>
    <property name="defaultButton">okButton</property>

    <control type="menu">
      <item label="Menu">
        <item>Menu1</item>
        <item>Menu2</item>
      </item>
    </control>

    <control type="label" style="SEPARATOR, HORIZONTAL">
      <layoutData name="horizontalAlignment">FILL</layoutData>
    </control>

    <composite type="box" layout="fill"
      layoutParam="type=HORIZONTAL; spacing=5">
      <layoutData name="horizontalAlignment">FILL</layoutData>
      <control type="button" id="okButton">
        <property name="text">OK</property>
      </control>
      <control type="button" id="ngButton">
        <property name="text">NG</property>
      </control>
    </composite>

  </window>
</template>
