<?xml version="1.0" encoding="UTF-8"?>
<!DOCTYPE template PUBLIC "-//SEASAR//DTD S2JFace 0.1//EN" 
	"http://www.seasar.org/dtd/s2jface01.dtd">
<template name="tabRendererTest">
  <window id="tabRendererTest" title="TabRendererTest" x="center"
    y="middle" minButton="false" maxButton="false" closeButton="false"
    resizable="false" layout="grid" layoutParam="numColumns=1">
    <property name="defaultButton" value="okButton" />

    <composite type="box" layout="fill"
      layoutParam="type=HORIZONTAL; marginHeight=10; marginWidth=10; spacing=10">
      <layoutData name="horizontalAlignment" value="FILL" />

      <control type="tab">
      	<property name="text" value="tab1-1, tab1-2" />
      </control>

      <control type="tab">
      	<property name="text" value="tab2-1, tab2-2, tab2-3" />
      </control>
    </composite>
 
    <control type="label" style="SEPARATOR, HORIZONTAL">
      <layoutData name="horizontalAlignment" value="FILL" />
    </control>

    <composite type="box" layout="fill"
      layoutParam="type=HORIZONTAL; spacing=5">
      <layoutData name="horizontalAlignment" value="FILL" />
      <control type="button" id="okButton">
        <property name="text" value="OK" />
      </control>
      <control type="button" id="ngButton">
        <property name="text" value="NG" />
      </control>
    </composite>

  </window>
</template>
